<?xml version="1.0" encoding="UTF-8"?>

		<!ELEMENT meta (filterClass|classes)*>
		<!ELEMENT filterClass (#PCDATA)>
		<!ELEMENT classes (class)*>
		<!ELEMENT class (cinfo|id|fields)*>
		<!ATTLIST class
				fqn CDATA #REQUIRED>
		<!ELEMENT cinfo (#PCDATA)>
		<!ATTLIST cinfo
				ignore (true|false)
				hasForm (true|false)
				hasAdd (true|false)
				hasList (true|false)
				hasFVO (true|false)
				>
		<!ELEMENT id (#PCDATA)>
		<!ATTLIST id
				ref CDATA #REQUIRED>
		<!ELEMENT fields (field)*>
		<!ATTLIST field
				name CDATA #REQUIRED>
		<!ELEMENT field (finfo)*>
		<!ELEMENT finfo (#PCDATA|htmlAttr?)>
		<!ATTLIST finfo
				ignore (true|false)
				hasForm (true|false)
				hasList (true|false)
				hasFVO (true|false)
				listType (simple|search)
				hasTimePart (true|false)
				required (true|false)
				textType (simple|multiline|richtext|code)
				codeType (XML|SQL|PL_SQL|MS_SQL|MY_SQL|GROOVY)
				>
		<!ELEMENT htmlAttr (#PCDATA)>
